school_id,school_name,sort_name,text
13001,北京大学,PKU,北京大学创办于1898年，初名京师大学堂，是中国第一所国立综合性大学，也是当时中国最高教育行政机关。辛亥革命后，于1912年改为现名。 学校为教育部直属全国重点大学，国家“211工程”、“985工程”建设大学、C9联盟，以及东亚研究型大学协会、国际研究型大学联盟、环太平洋大学联盟、东亚四大学论坛的重要成员。
9002,南京大学,NJU,南京大学坐落于钟灵毓秀、虎踞龙蟠的金陵古都，其前身是创建于1902年的三江师范学堂，此后历经两江师范学堂、南京高等师范学校、国立东南大学、第四中山大学、国立中央大学、国立南京大学等历史时期。经过百余年的积淀，现已发展成为国内顶尖、世界知名的一流大学。南京大学是国家“211工程”重点支持的大学，首批 “985工程”重点建设的9所高水平大学之一，首批“基础学科拔尖学生培养试验计划”、“2011计划”入选高校之一，中国大学C9联盟、东亚研究型大学协会、环太平洋大学联盟的成员。
6001,浙江大学,ZJU,浙江大学（Zhejiang University）简称“浙大”，前身是1897年创建的求是书院，是中国人自己最早创办的现代高等学府之一。1928年更名为国立浙江大学。中华民国时期，浙江大学在竺可桢老校长的带领下，成长为中国最顶尖的大学之一，被英国著名学者李约瑟誉为“东方剑桥”。浙大是中国首批7所“211工程”大学，首批9所“985工程”重点建设的全国重点大学，中国大学C9联盟、世界大学联盟、环太平洋大学联盟的成员，是联合国教科文组织全球大学创新联盟亚太中心牵头单位，是中国著名顶尖学府之一。
9003,复旦大学,FUDAN,复旦大学，始建于1905年，初名复旦公学，创始人为中国近代知名教育家马相伯，首任校董为国父孙中山先生。复旦大学是教育部与上海市共建的首批全国重点大学，中国首批7所211工程、9所985工程大学，首批“珠峰计划”、“111计划”和中国顶尖学府“九校联盟”（C9联盟）的成员大学。学校学术交流活跃，涵盖了文学、理学、医学、哲学、经济学、法学、历史学、工学等十大学科门类，拥有邯郸、枫林、张江、江湾四大校区。
8011,北京航空航天大学,BUAA,北京航空航天大学（Beihang University）是中华人民共和国工业和信息化部直属的一所综合性全国重点大学，是国家“985工程”、“211工程”重点建设高校，是首批16所全国重点大学之一，入选“珠峰计划”、“2011计划”、“111计划”、“卓越工程师教育培养计划”、“卓越法律人才教育培养计划”，是“国际宇航联合会”、”中欧精英大学联盟“、“T.I.M.E.联盟”、“中国-西班牙大学联盟”、“中俄工科大学联盟”成员，为中管副部级高校，由中国工程院、工信部、教育部、北京市共建，设有研究生院。
9010,武汉大学,WHU,"武汉大学是国家教育部直属重点综合性大学，是国家“985工程”和“211工程”重点建设高校。
    武汉大学溯源于1893年清末湖广总督张之洞奏请清政府创办的自强学堂，历经传承演变，1928年定名为国立武汉大学，是近代中国第一批国立大学。1946年，学校已形成文、法、理、工、农、医 6大学院并驾齐驱的办学格局。
    2000年，武汉大学与武汉水利电力大学、武汉测绘科技大学、湖北医科大学合并组建新的武汉大学，揭开了学校改革发展的崭新一页。合校十多年来，学校综合实力和核心竞争力不断提升。"
8007,北京理工大学,BIT,北京理工大学（Beijing Institute of Technology），是中华人民共和国工业和信息化部直属的以理工为主干，工、理、管、文协调发展的全国重点大学，是首批“211工程”和“985工程”重点建设高校之一，是首批16所全国重点高校之一，是“111计划”、“卓越工程师教育培养计划”、“国家建设高水平大学公派研究生项目”入选高校之一，建有研究生院。学校前身为1940年创建于延安的延安自然科学院，是中国共产党创办的第一所理工科大学；1988年，学校更名为北京理工大学。
9020,中国农业大学,CAU,"中国农业大学起源于1905年成立的京师大学堂农科大学。1995年9月，经国务院批准，北京农业大学与北京农业工程大学合并成立新的中国农业大学。中国农业大学是中国现代农业高等教育的起源地，是国家“211工程”和“985工程”重点建设的教育部直属高校。
历经百年的世纪风雨，中国农业大学已经发展成为一所以农学、生命科学和农业工程为特色和优势的研究型大学，形成了特色鲜明、优势互补的农业与生命科学、资源与环境科学、信息与计算机科学、农业工程与自动化科学、经济管理与社会科学等学科群。"
9018,北京师范大学,BNU,北京师范大学是教育部直属重点大学，是一所以教师教育、教育科学和文理基础学科为主要特色的著名学府。学校的前身是1902年创立的京师大学堂师范馆，1908年改称京师优级师范学堂，独立设校，1912年改名为北京高等师范学校。1923年学校更名为北京师范大学，成为中国历史上第一所师范大学。1931年、1952年北平女子师范大学、辅仁大学先后并入北京师范大学。
9022,中央民族大学,MUC,中央民族大学是党和国家为解决中国民族问题、培养少数民族干部和高级专门人才而创建的一所具有鲜明特色的高等学校，在我国高等教育体系和民族团结进步事业中具有不可替代的地位。学校前身是1941年成立的延安民族学院。新中国成立后，经中央人民政府批准，1951年在北京正式成立中央民族学院，乌兰夫任首任院长。1993年学校更名为中央民族大学。在党和国家的高度重视和关怀下，学校先后进入国家“211工程”重点建设大学、国家“985工程”重点建设大学和国家“双一流”建设高校行列。
9006,南开大学,NKU,南开大学（Nankai University），简称南开，肇始于1904年，正式成立于1919年，是由严修、张伯苓秉承教育救国理念创办的综合性大学。1937年校园遭侵华日军炸毁，学校南迁，1938年与北京大学、清华大学在云南昆明合组西南联合大学，为中华民族振兴和国家富强作出了不可磨灭的重要贡献。1946年回天津复校并改为国立。新中国成立后，经历高等学校院系调整，成为文理并重的全国重点大学。
9004,天津大学,TJU,天津大学是教育部直属国家重点大学，其前身为北洋大学，始建于1895年10月2日，是中国第一所现代大学，素以“实事求是”的校训、“严谨治学”的校风和“爱国奉献”的传统享誉海内外。1951年经国家院系调整定名为天津大学，是1959年中共中央首批确定的16所国家重点大学之一，是“211工程”、“985工程”首批重点建设的大学。在党和国家领导的支持和关心下，天津大学已成为一所师资力量雄厚、学科特色鲜明、教育质量和科研水平居于国内一流、在国际上有较大影响的高水平研究型大学。
8009,大连理工大学,DUT,大连理工大学是教育部直属全国重点大学，也是国家“211工程”和“985工程”重点建设高校。学校以培养精英人才、促进科技进步、传承优秀文化、引领社会风尚为宗旨，秉承“海纳百川、自强不息、厚德笃学、知行合一”的精神，致力于创造、发现、传授、保存和应用知识，勇于担当社会责任，服务国家，造福人类。
8008,吉林大学,JLU,吉林大学坐落在吉林省长春市，是教育部直属的全国重点综合性大学，1995年首批通过国家教委“211工程”审批，2001年被列入“985工程”国家重点建设的大学之一。 吉林大学于2000年6月12日由原吉林大学、吉林工业大学、白求恩医科大学、长春科技大学、长春邮电学院合并组建而成。2004年8月29日，原中国人民解放军军需大学并入吉林大学。合并前的六所学校，都有着光荣的历史。吉林大学已成为我国目前办学规模最大的高等学府，在人才培养、科学研究、学科建设、师资队伍等方面呈现出广泛的发展前景。
9005,哈尔滨工业大学,HIT,哈尔滨工业大学（Harbin Institute of Technology），简称哈工大，是首批中央直属管理、工业和信息化部直属的全国重点大学，由工信部、教育部、黑龙江省共建的国家重点大学，是首批进入国家“211工程”、“985工程”、“111计划”和首批“2011计划”、首批“卓越计划”建设的若干所大学之一，是中国顶尖学府“九校联盟”的重要成员。学校坐落在中国北方冰城哈尔滨市，同时在威海市和深圳市分别设有哈尔滨工业大学（威海）和哈尔滨工业大学深圳研究生院，形成了“一校三区”的办学格局。
8012,东北大学,NEU,东北大学建于1923年4月，是一所具有爱国主义光荣传统的大学。1949年3月，在东北大学工学院、理学院（部分）的基础上成立了沈阳工学院。1950年8月，沈阳工学院、抚顺矿专和鞍山工专合组为东北工学院。1960年被列为全国64所重点大学之一。是国务院首批批准有权授予学士、硕士和博士学位的大学。1993年3月8日，东北工学院复名为东北大学。1998年9月，东北大学由原冶金部属院校划转为教育部直属高校。学校是国家首批“211工程”和“985工程”重点建设的高校，并实现教育部、辽宁省、沈阳市重点共建。
8013,同济大学,TONGJI,同济大学是国家“985工程”和“211工程”重点建设的教育部直属高校，在百余年办学历程中，始终注重人才培养、科学研究、社会服务、文化传承创新四大功能均衡发展，综合实力位居国内高校前列。 同济大学的前身是1907年德国医生埃里希·宝隆在上海创办的德文医学堂，1927年成为国立同济大学，是中国最早的七所国立大学之一。“同心同德同舟楫，济人济事济天下”。今天的同济大学正满怀豪情，朝着“建设以可持续发展为导向的世界一流大学”的目标奋力前行！
8003,上海交通大学,SJTU,上海交通大学是我国历史最悠久、享誉海内外的著名高等学府之一，是教育部直属并与上海市共建的全国重点大学。经过122年的不懈努力，上海交通大学已经成为一所“综合性、研究型、国际化”的国内一流、国际知名大学。  一百多年来，学校为国家和社会培养了20余万各类优秀人才，包括一批杰出的政治家、科学家、社会活动家、实业家、工程技术专家和医学专家。截至2017年12月，学校共有29个学院/直属系，24个研究院，13家附属医院，2个附属医学研究所，12个直属单位，6个直属企业。
8015,华东师范大学,ECNU,"华东师范大学是教育部直属、教育部与上海市共建的首批全国重点大学，是列入国家“211工程”，“985工程”,“2011计划”的重点建设的综合性研究型大学，是教育部“援疆学科建设计划”40所重点高校之一，同时也是国家“111计划”和“长三角高校合作联盟”的重要成员。华东师范大学成立于1951年10月16日，学校是以大夏大学（1924年）、光华大学（1925年）为基础，同时调进复旦大学、浙江大学、同济大学和圣约翰大学等高校的部分系科，在大夏大学原址上创办的新中国第一所师范大学。"
9011,中国人民大学,RUC,中国人民大学（Renmin University of China）是一所以人文社会科学为主的综合性研究型全国重点大学，直属于教育部，由教育部与北京市共建。学校的前身是1937年诞生于抗日战争烽火中的陕北公学，以及后来的华北联合大学和华北大学。1949年12月16日，中央人民政府政务院第十一次政务会议根据中共中央政治局的建议，通过了《关于成立中国人民大学的决定》。1950年10月3日，以华北大学为基础合并组建的中国人民大学隆重举行开学典礼，成为新中国创办的第一所新型正规大学。
9009,东南大学,SEU,"东南大学是中央直管、教育部直属的全国重点大学，是“985工程”和“211工程”重点建设的大学之一。学校坐落于历史文化名城南京，占地面积5880亩，建有四牌楼、九龙湖、丁家桥等校区。
        东南大学是我国最早建立的高等学府之一，素有“学府圣地”和“东南学府第一流”之美誉。东南大学前身是创建于1902年的三江师范学堂。1921年经近代著名教育家郭秉文先生竭力倡导，以南京高等师范学校为基础正式建立国立东南大学，成为当时国内仅有的两所国立综合性大学之一。"
9001,中国科学技术大学,USTC,中国科学技术大学，简称“中国科大”，是中国科学院直属的一所以前沿科学和高新技术为主、兼有特色管理和人文学科的综合性全国重点大学，是国家首批7所“211工程”和首批9所“985工程”建设的大学之一，也是唯一参与中科院“知识创新工程”的大学，为中国科学院、教育部和安徽省重点共建高校，是九校联盟（C9）成员、中国大学校长联谊会成员、东亚研究型大学协会成员、环太平洋大学联盟成员，是首批“2011协同创新中心”和中科院知识创新工程重点建设院校。
8002,厦门大学,XMU,"厦门大学由著名爱国华侨领袖陈嘉庚先生于1921年创办，是中国近代教育史上第一所华侨创办的大学，也是国家“211工程”和“985工程”重点建设的高水平大学。
建校以来，学校秉承“自强不息，止于至善”的校训，积累了丰富的办学经验，形成了鲜明的办学特色，成为一所学科门类齐全、师资力量雄厚、居国内一流、在国际上有广泛影响的综合性大学。建校迄今，已先后为国家培养了30万多名本科生和研究生，在厦大学习、工作过的两院院士达60多人。"
8005,山东大学,SDU,山东大学是中国近代高等教育的起源性大学之一，其主体创建于清光绪27年（公元1901年），初名山东大学堂，是继京师大学堂之后中国创办的第二所国立大学，是中国第一所按章程办学的大学。此后学校先后历经了山东大学堂、山东高等学堂、国立青岛大学、国立山东大学、山东大学以及由原山东大学、山东医科大学、山东工业大学三校合并组建的新山东大学等几个历史发展时期。是教育部直属综合性全国重点大学，国家“211工程”、“985工程”大学，国家“111计划”、“珠峰计划”、“卓越计划”建设高校。
8004,中国海洋大学,OUC,中国海洋大学（Ocean University of China）原名青岛海洋大学，位于中国山东省青岛市。始建于1924年，是教育部直属的一所以海洋和水产学科为特色，包括理学、工学、农学、医（药）学、经济学、管理学、文学、法学、教育学、历史学等学科门类较为齐全的教育部直属综合性大学，是国家“985工程”、“211工程”和“卓越工程师教育培养计划”重点建设建设大学之一，是国务院学位委员会首批批准的具有博士、硕士、学士学位授予权的单位。
9008,华中科技大学,HUST,"华中科技大学是国家教育部直属的全国重点大学，由原华中理工大学、同济医科大学、武汉城市建设学院于2000年5月26日合并成立，是首批列入国家“211工程”重点建设和国家“985工程”建设高校之一。
学校贯彻建设“学生、学者与学术的大学”的教育思想，秉承“育人为本、创新是魂、责任以行”的办学理念，坚持“一流教学、一流本科”的建设目标，采取多种举措，深化教育教学改革，全面推进素质教育，构建和完善充满活力的创新人才培养体系。几十年来，已为国家培养了近40万名高级人才。"
8006,湖南大学,HNU,湖南大学，简称湖大，坐落在湖南长沙湘江西岸的国家5A级风景名胜岳麓山风景名胜区。是隶属教育部的全国重点大学，“211工程”、“985工程”重点建设高校，“111计划”、“卓越工程师教育培养计划”、“卓越法律人才教育培养计划”建设高校，是“卓越研究生生源合作协议”高校成员之一和“高水平大学优秀研究生生源互推联盟”高校成员之一。
9019,中南大学,CSU,中南大学（Central South University）坐落在中国历史文化名城——湖南省长沙市，是中央直管、教育部直属的湖南省唯一副部级全国重点大学，国家“211工程”、“985工程”、“2011计划”首批重点建设的大学，是“111计划”、“卓越工程师教育培养计划”、“卓越医生教育培养计划”、“卓越法律人才教育培养计划”入选高校，是教育部、工业和信息化部、湖南省三方重点共建大学。
8014,国防科技大学,NUDT,"国防科技大学（National University of Defense Technology）坐落于湖南长沙，前身是1953年创建于黑龙江省哈尔滨市的军事工程学院，简称“哈军工”，1970年学校主体南迁长沙，改名为长沙工学院，1978年改建为国防科学技术大学。是国防部和教育部双重领导下的国家重点综合性大学，列入国家“985工程”和“211工程”的重点建设。
学校为一所涵盖理学、工学、军事学、管理学、经济学、哲学、文学、教育学、法学、历史学等10个学科门类的综合大学。"
8010,中山大学,SYSU,中山大学由孙中山先生创办，有着一百多年办学传统，是学术与文化中国南方重镇和人才培养南方高地。主校区位于中国现代大都市──广州，校区同时延伸至美丽的海滨城市珠海。作为中国教育部直属高校，在教育部和广东省共同支持下，通过“211工程”和“985工程”的建设，中山大学已经成为一所国内一流、国际知名大学，正在向世界一流大学迈进，努力成为全球学术重镇。
9015,华南理工大学,SCUT,"华南理工大学是直属教育部的全国重点大学，坐落在南方名城广州，占地面积294多万平方米,原名华南工学院，组建于1952年全国高等学校院系调整时期。经过60多年的建设和发展，华南理工大学成为以工见长，理工结合，管、经、文、法等多学科协调发展的综合性研究型大学。
轻工技术与工程、食品科学与工程、城乡规划学、材料科学与工程、建筑学、化学工程与技术、风景园林学等学科整体水平进入全国前十位。化学、材料学、工程学、农业科学、物理学、生物学与生物化学6个学科进入国际ESI全球排名前1%。"
9014,四川大学,SCU,四川大学是教育部直属全国重点大学，是布局在中国西部、“985工程”和“211工程”重点建设的高水平研究型综合大学。四川大学由原四川大学、原成都科技大学、原华西医科大学三所全国重点大学经过两次合并而成。四川大学在长期的办学历程中，形成了深厚的人文底蕴、扎实的办学基础和以校训“海纳百川，有容乃大”、校风“严谨、勤奋、求是、创新”为核心的川大精神。
9012,重庆大学,CQU,"重庆大学坐落于长江上游地区经济和金融中心、美丽的山水都市——中央直辖市重庆，是中央直管、教育部直属的副部级全国重点大学，国家“211工程”、“985工程”首批重点建设的大学，“2011计划”、“111计划”入选高校，“卓越大学联盟”的主要成员。
重庆大学创办于1929年，经1952年全国院系调整，重大在1960年成为全国重点大学；2000年，学校与重庆建筑大学、重庆建筑高等专科学校（大专和中专部）合并组建新的重庆大学。"
9013,电子科技大学,UESTC,电子科技大学（University of Electronic Science and Technology of China）是教育部直属、国家“985工程”“211工程”重点建设大学、国家“双一流”建设高校（A类），坐落于有“天府之国”之称的西部经济、文化、交通中心——四川省成都市，是一所完整覆盖整个电子类学科，以电子信息科学技术为核心，以工为主，理工渗透，理、工、管、文、医协调发展的多科性研究型大学，被誉为“电子类院校排头兵”“民族电子工业摇篮”。
9007,西安交通大学,XJTU,西安交通大学是国家教育部直属重点大学，为我国最早兴办的高等学府之一。其前身是1896年创建于上海的南洋公学，1921年改称交通大学，1956年国务院决定交通大学内迁西安，1959年定名为西安交通大学，并被列为全国重点大学。西安交通大学是“七五 ”、“八五”首批重点建设项目学校，是首批进入国家“211”和 “985”工程建设，被国家确定为以建设世界知名高水平大学为目标的学校。2017年，在国家公布的“双一流”建设名单中，入选一流大学A类建设高校，8个学科入选一流建设学科。
9017,西北工业大学,NWPU,西北工业大学坐落于古都西安，是一所以发展航空、航天、航海工程教育和科学研究为特色，以工、理为主，管、文、经、法协调发展的研究型、多科性和开放式的科学技术大学，隶属于工业和信息化部。是“卓越大学联盟”成员高校之一。学校1960年被国务院确定为全国重点大学，“七五”、“八五”均被国务院列为重点建设的全国15所大学之一，“九五”首批进入国家“211工程”立项建设，“十五”进入国家“985工程”重点建设。
9021,西北农林科技大学,NWSUAF,西北农林科技大学地处国家级农业高新技术产业示范区——陕西杨凌，教育部直属、国家“985工程”和“211工程”重点建设高校，首批入选国家“世界一流大学和一流学科”建设高校。学校前身是创建于1934年的国立西北农林专科学校。1999年经国务院批准，由原西北农业大学、西北林学院、中国科学院水利部水土保持研究所等7所科教单位合并组建。建校80多年来，学校秉承“经国本，解民生，尚科学”的办学理念坚持走产学研相结合的办学道路，为推动我国农业现代化建设和农业科教事业发展做出了突出贡献。
9016,兰州大学,LZU,兰州大学（Lanzhou University），是教育部直属的全国重点大学。学校位于甘肃省省会兰州市，是中国高层次人才培养和科学技术研究的重要基地，始于1909年创建的甘肃法政学堂，学校名列国家“985工程”、“211工程”重点建设高校，是国家32所副部级重点建设高校之一，教育部批准建研究生院的56所高校之一，是国家研究生自主划线的34所名牌大学之一，是北约高校联盟和上海合作组织大学重要成员之一，也是国家“111计划”、“珠峰计划”、“2011计划”、“卓越法律人才培养计划”重点建设名校。
1001176003,北京工业大学,bjut,北京工业大学创建于1960年，是以工为主，理、工、经、管、文、法、艺术相结合的市属重点大学。1981年成为硕士学位授予单位，1985年成为博士学位授予单位，1996年跨入“211工程”重点大学行列。2017年进入一流学科建设行列。现有64个本科专业、33个硕士学位授权点、20个博士学位授权点、3个国家重点学科、39个市重点学科。坚持“立足北京，服务北京，辐射全国，面向世界”定位；秉承“不息为体，日新为道”校训，实施人才强校、特色发展和开放办学战略，开启世界一流大学和一流学科建设新征程。
20002,中央财经大学,CUFE,中央财经大学（Central University of Finance and Economics）是教育部直属，教育部、财政部和北京市共建的大学，是国家“双一流”建设、“211工程”建设和首批“优势学科创新平台”项目建设高校，2017年9月成为国家“世界一流学科建设高校”。学校拥有应用经济学国家“双一流”建设学科，是首批实施“长江学者奖励计划”的人文社科类院校。长期以来，学校秉持“忠诚、团结、求实、创新”的校训，传承“求真求是，追求卓越”的办学理念，形成了鲜明的办学特色，为国家经济建设和社会发展培养了14万余名各级各类高素质人才，被誉为“中国财经管理专家的摇篮”。
