school_id,school_name,sort_name,text
1203139801,德州职业技术学院,DZVC,"德州职业技术学院坐落于京津冀协同发展示范城市——山东省德州市，承载着为党育人育才、职教报国兴市的使命。
学校是人力资源和社会保障部评选的国家高技能人才培养示范基地、国家高技能人才培训基地，是教育部评选的2015年度全国毕业生就业工作典型经验高校、2017年度全国创新创业典型经验高校，是山东省技能型人才培养特色名校和山东省优质高等职业院校立项建设单位。
学校占地面积1190亩，建筑面积30余万平方米，固定资产7亿元，其中教学、科研仪器设备资产值1.54亿元。校内实训基地26个，校外实习基地271个。投资2.92亿元、建设7个实训中心的德州市职业教育公共实训中心总部落户学校，学校实习实训条件跃居全省同类院校一流水平。"
1203149801,山西农业大学,SXAU,山西农业大学简称山西农大，是山西省人民政府与中华人民共和国农业农村部共建的全国重点大学，是山西省唯一的农业高校，首批获得硕士学位授权、第七批获得博士学位授权的高校之一，国家首批“卓越农林人才教育培养计划”试点高校，教育部本科教学评估优秀高校，全国首批深化创新创业教育改革示范高校，国家“中西部高校基础能力建设工程”入选高校，国家级大学生创新创业训练计划实施高校，全国农业农村信息化示范基地，山西省高等教育综合改革试点高校，
1443972161,西南医科大学,SWMU,西南医科大学是四川省省属普通高等院校，坐落于川渝滇黔结合区域的国家历史文化名城、全国文明城市——泸州。其前身西南区川南医士学校始建于1951年，1959年升格为泸州医学专科学校，1978年升格为本科院校并更名为泸州医学院，1982年获得学士学位授予权，1993年成为硕士学位授予单位，2001年开始联合培养博士，2004年起开展留学本科生学历教育，2010年获准设立博士后科研工作站，2015年更名为西南医科大学。学校是四川省依法治校示范学校、四川省文明校园、四川省高等学校教育信息化示范学校。
1444124161,西安航空学院,XAAU,西安航空学院是一所以工科为主、多学科协调发展的全日制普通高等学校，位于历史文化名城西安。学校创建于1955年，原名为西安航空工业学校，隶属原航空工业部。1957年合并兰州航空工业学校。1960年升格为专科学校，更名为西安航空工业专科学校，后因国民经济调整而复原。1985年经原国家教委批准升格为西安航空工业技术专科学校，1993年更名为西安航空技术高等专科学校。1999年划转地方，隶属陕西省人民政府，为中央与地方共建院校。2012年经教育部批准升格为普通本科院校，更名为西安航空学院。
1444506161,四川旅游学院,STC,1.四川旅游学院是中国第一所独立设置的旅游类普通本科高等学校，是全国100所“应用型本科高校产教融合发展工程项目”建设高校，四川省教育综合改革首批试点高校，四川省本科院校整体转型发展改革试点高校2018年，被国务院侨办批准为“海外惠侨工程----中餐繁荣基地”。学校坚持“地方性、应用型”办学定位，肩负“强旅报国”的历史使命，不断深化教育改革，传承中国优秀旅游、烹饪文化，培养适应经济社会发展的应用型人才。
1444545161,首都医科大学,CCMU,首都医科大学创建于1960年，原名北京第二医学院，1985年更名为首都医学院，1994年更名为首都医科大学，是北京市重点高等院校，是北京市政府、国家卫生健康委员会、教育部共建院校。学校坚持以立德树人为根本，秉承“扶伤济世、敬德修业”的校训，遵循医学教育规律，牢记社会责任，把为健康中国健康北京建设、京津冀协同发展战略实施、国际一流和谐宜居之都建设做贡献为己任，努力办人民满意的大学，培养人民满意的医生。
1444645161,培训需求学校,PXXQXX,培训学校
1001397007,天津传媒学院,TJYYWH,天津体育学院运动与文化艺术学院是2004年经国家教育部批准成立的独立学院，是以培养我国急需的文化艺术与传媒类人才为主要办学定位的普通本科高等学校。
1001396002,天津工业大学,TJGYDX,天津工业大学是教育部与天津市共建、天津市重点建设的全日制普通高等学校。学校办学历史悠久，最早的学科始建于1912年，1958年开始独立办学，原名河北纺织工学院，1968年更名为天津纺织工学院，2000年更名为天津工业大学，2017年入选国家“双一流”世界一流学科建设高校，2018年获批国防科工局与天津市共建高校，深度融入军民融合发展战略，是我国最早开展纺织高等教育的学府之一，现已发展成为一所以工为主，工、理、文、管、经、法、艺协调发展的多科性工业大学。
1001398002,天津商业大学,TJSYDX,天津商业大学的前身是天津商学院，由国家商业部和天津市人民政府于1980年创建。1998年实行中央与地方共建、以地方管理为主的管理体制。2007年更名为天津商业大学。学校以建设商科特色鲜明、对接社会需求的高水平大学为目标，服务经济社会发展。
1001403001,天津体育学院,TJUS,天津体育学院成立于1958年8月。当时，根据中共河北省委“10-15年普及高等教育的方针和适应教育、体育事业发展的需要”，并为准备1959年9月在北京举行的中华人民共和国第一届运动会，河北省人民委员会决定在河北省省会天津市，由原天津体育学校、石家庄师范学院体育系合并，同时在全省抽调优秀运动员，组建天津体育学院。学院的任务是培养运动员、教练员和部分高中及大学的体育教师及较高级体育专业人才。
1203094801,山东交通学院,SDJTU,山东交通学院（ShanDong JiaoTong University）位于山东省济南市，是中华人民共和国交通运输部与山东省人民政府共建高校，为“山东特色名校工程”重点建设的应用型人才培养特色高校，教育部“应用科技大学改革试点战略研究”项目首批试点院校，教育部首批“新工科”研究与实践项目入选高校。
1203173801,浙江海洋大学,ZJHY,浙江海洋大学是自然资源部与浙江省人民政府共建的以海洋为特色的教学研究型大学。学校创建于1958年，2000年之后舟山卫生学校、浙江水产学校、浙江省海洋水产研究所、舟山石油化工学校和舟山商业学校等学校（单位）相继并（进）入，2016年更为现名。60年来，学校积淀形成了“海纳百川、自强不息”的校训精神，为我国东部特别是浙江省海洋人才培养、科技创新、产业升级和文化传承做出了重要贡献，逐步探索出了一条符合高等教育发展规律、与区域经济社会发展紧密结合、海洋特色日趋鲜明的办学之路。
56001,河北大学,HBU,河北大学是教育部与河北省人民政府“部省合建”高校，也是河北省重点支持的国家一流大学建设一层次高校。学校始建于1921年，初名天津工商大学。建校九十余年来，育就了“实事求是”的校训传统，“博学、求真、惟恒、创新”的校风精神。学校设有一级学科博士点15个；一级学科硕士点46个，硕士专业学位授权类别30种；95个本科专业。学科专业分布在哲学、经济学、法学、教育学、文学、历史学、理学、工学、农学、医学、管理学、艺术学12大门类，是全国学科门类设置最齐全的高校之一。
128001,燕山大学,YSU,燕山大学位于河北省秦皇岛市，源于哈尔滨工业大学，始建于1920年，是河北省人民政府、教育部、工业和信息化部、国家国防科技工业局四方共建的全国重点大学，河北省重点支持的国家一流大学和世界一流学科建设高校，北京高科大学联盟成员，占地面积4000亩，师生员工4万余名，现有64个本科专业，其中11个专业通过工程教育专业认证，学科格局合理，主要服务国家装备制造业、战略性新兴产业、国防科技工业和区域经济社会发展。
1001508001,河北经贸大学,HEUET,河北经贸大学是河北省重点建设的骨干大学，是一所以经济学、管理学、法学为主，兼有文学、理学、工学和艺术学的多学科财经类大学。学校始于1953年创办的河北省供销合作社石家庄合作学校，1995年由河北财经学院、河北经贸学院、河北商业高等专科学校合并组建而成。
1001586004,西华大学,XHDX,西华大学（Xihua University）简称“西华”，位于四川省成都市，是一所学科门类齐全、多学科协调发展的省属重点综合性大学，入选“中西部高校基础能力建设工程”、“卓越工程师教育培养计划2.0”、“四川2011计划”、四川省卓越工程师教育培养计划”、“四川省“双一流”建设计划”，是中国人民解放军全军“边防军人子女预科班”入选高校、教育部易班全国共建示范高校，四川省深化创新创业教育改革示范高校，具有向全国推荐优秀应届本科毕业生免试攻读硕士研究生的资格。
1001463001,延安大学,YADX,"延安大学是毛泽东同志亲自命名、中国共产党创办的第一所综合性大学,其历史可以上溯到1937年的陕北公学。1941年，中共中央政治局决定将陕北公学、中国女子大学、泽东青年干部学校合并成立延安大学。之后，延安鲁迅艺术文学院、自然科学院、民族学院等相继并入。1947年延安大学部分师生远赴东北、华北、西北各地办学。1958年7月，陕西省人民政府决定重建延安大学。学校现为陕西省人民政府与教育部共建大学、陕西省属重点大学、陕西省高水平建设大学。"
1001570001,南昌航空大学,NCHKDX,"南昌航空大学是江西省人民政府与国家国防科技工业局共建的高等学校，是教育部第二批卓越工程师教育培养计划实施高校，是“中国政府奖学金”来华留学生培养院校，是教育部本科教学工作水平评估优秀高校。
　　学校大学生创新创业基地命名为第三批江西省大学生创业孵化基地创建单位，并确定为全国“大学生KAB创业教育基地”。在2013—2017年中国高校创新人才培养暨学科竞赛评估中位居全国第111位；在“全国高校团学创业教育工作指数100强”中位列第56位，为江西省高校之最。"
1001585001,河北医科大学,HJYK,河北医科大学（Hebei Medical University），简称“河北医大”，位于河北省省会石家庄市，由河北省人民政府、国家卫生和计划生育委员会和教育部三方共建， 入选国家“中西部高校基础能力建设工程”、“卓越医生教育培养计划”、“特色重点学科项目”，是一所具有百年历史和优良医学教育传统的省属重点骨干大学；现已成为集教学、科研、医疗为一体的综合性医科大学。
1444153162,安庆师范大学,AQNU,Anqing Normal University，简称安庆师大（AQNU），位于国家历史文化名城—安徽省安庆市，是直属于安徽省人民政府的全日制普通高等学校，是教育部高校本科教学工作水平评估优秀院校、全国首批拥有学士学位授予权单位。学校入选第二期“中西部高校基础能力建设工程”项目、“数据中国”百校工程首批试点院校、国家大学生文化素质教育基地。
1202993801,闽南师范大学,MNNU,"闽南师范大学是福建省重点建设大学。由原龙溪师范学校于1958年设立师范大专班发展而来；1986年更名为漳州师范学院；2013年更名为闽南师范大学，同时本科专业列入本一批招生。
 学校坚持以本科教育为主体，积极发展研究生教育，适度发展继续教育和留学生教育。现有18个学院，62个本科专业，拥有4个一级学科硕士授予点，30个二级学科硕士点，5个硕士专业学位授权点，4个博士人才培养方向。
学校秉承“博学、明理、砺志、笃行”校训，根植闽南，立足福建，面向全国，为社会输送了大批优秀专门人才。"
1203013801,浙江音乐学院,ZJYY,浙江音乐学院
1001237003,南京工业大学,NJTECH,"南京工业大学具有百年办学历史，于2001年由原南京化工大学与原南京建筑工程学院合并而成，是国家首批入选“高等学校创新能力提升计划（2011计划）”的14所高校之一，是江苏省重点建设高校。
学校设有本科专业81个，拥有国家级特色专业建设点12个，教育部专业综合改革试点2个，教育部卓越工程师教育培养计划试点专业7个，国家级精品课程3门，国家级双语教学示范课程2门，国家级精品资源共享课2门，江苏高校品牌专业建设工程一期项目5个。"
1001237007,常州工学院,CZU,常州工学院是一所全日制普通本科院校，历经40余年发展，已成为一所以工科为主，工学、理学、管理学、经济学、文学、教育学、艺术学7大学科门类协调发展、综合性较强的多科性地方高等学校。学校设有58个本科专业，普通全日制在校生15000余人，在职教职工近1200人。学校始终坚持面向基层、服务地方的办学定位，已为社会培养输送了10万余名高素质人才。学校是国家“十三五”产教融合发展工程立项高校和首批启动高校，教育部卓越工程师教育培养计划试点高校，江苏省服务外包人才培养试点高校。
1001237011,宿迁学院,SQC,    2002年6月，宿迁学院与苏州大学等八所省属高校合作举办本科教育。2014年，学校经教育部批准为独立设置的民办普通本科院校；2018年，学校通过省学位办评审成为学士学位授权单位；2020年，经教育部批准，宿迁学院成功转制为省属公办本科高校。
1001240004,江苏海洋大学,HHIT,江苏海洋大学是一所多科性应用研究型大学。学校创建于1985年，原名淮海工学院，2017年7月，学校成为博士学位授予立项建设单位；现有专任教师1160人，其中高级职称613人，正高150人，博士362人。全日制在校本科生18725人，硕士研究生140人；下设17个二级学院，开设63个本科专业；拥有江苏省海洋生物技术重点实验室等一批海洋特色鲜明、学科力量雄厚的科技研发和服务平台。近五年共主持和参与厅级以上科研项目500多个，发表论文5000多篇，三大检索收录1000余篇，申请专利200多项。
1001238003,南京医科大学,NMU,南京医科大学创建于1934年，是江苏省属重点建设高校，2015年9月，获批成为首批教育部、国家卫生计生委与省政府共建医学院校。学校建有两个校区，设有23个学院（部），在江苏、上海、浙江、山东等地拥有24所附属医院和51所教学医院。学校近年在师资、科研、教学等多方面取得了快速发展，“十三五”期间，学校明确了建成“国际知名、特色鲜明的高水平研究型医科大学”的发展目标，以培养高质量的医药卫生人才为核心，力争在教育教学、学科和专业建设、临床诊疗等方面形成品牌与特色。
1001238007,常州大学,CCZU,常州大学坐落于经济繁荣、人文荟萃的江南历史文化名城——江苏常州，是江苏省人民政府与中国石油天然气集团有限公司、中国石油化工集团有限公司及中国海洋石油集团有限公司共建的省属全日制本科院校，江苏高水平大学建设高峰计划建设高校。学校始建于1978年，前身为南京化工学院无锡分院、常州分院。1981年经国务院批准，学校定名为江苏化工学院；1984年实行江苏省人民政府和中国石油化工总公司联合办学机制；1992年成为中国石油化工集团有限公司（原中国石油化工总公司）管理的部属院校，并更名为江苏石油化工学院；2000年实行中央与地方共建、以江苏省管理为主的管理体制；2001年江苏省商业技工学校并入江苏石油化工学院；2002年学校更名为江苏工业学院；2010年经教育部批准更名为常州大学。学校历经45年的发展，现已建成完整的学士—硕士—博士人才培养体系以及多层次的科学研究和社会服务体系。
40001,苏州科技大学,USTS,苏州科技大学前身苏州科技学院是由原建设部直属的苏州城建环保学院与原铁道部直属的苏州铁道师范学院于2001年9月合并组建而成。学校坚持“立足江苏、服务行业、辐射全国、面向世界”，深入实施“人才强校、质量立校、特色名校、服务兴校、文化融校”五大战略，努力打造为地方和行业发展服务的高素质应用型人才培养基地、高水平应用研究基地、高层次决策咨询基地、高品位文化建设基地，不断提升综合实力，努力把学校建设成为有特色、有活力、有品位、国内外知名的高水平大学。
1001238011,淮阴工学院,HYIT,淮阴工学院为江苏省属普通本科院校，是“卓越工程师教育培养计划”、“卓越农林人才培养计划”试点高校、全国服务特需硕士专业学位研究生培养单位。学校现有16个二级学院，本科专业62个，拥有国家级卓越教育培养计划试点专业8个，国家级特色专业2个，国家级“专业综合改革”试点专业2个，省级品牌专业3个，省级特色专业4个，省“十二五”高等学校重点专业（类）6个， 在职教职工1389人，其中专任教师1068人，具有教授、副教授等高级职称人员454人，博士、硕士958人。
1001239003,南京晓庄学院,NJXZC,南京晓庄学院始于1927年3月由伟大的人民教育家陶行知先生创办并任校长的晓庄试验乡村师范。2002年3月，南京市师范专科学校、南京教育学院、南京市晓庄师范学校合并，升格为本科院校。学校现有本科专业52个，全日制在籍学生16500余人；现拥有国家“十二五”专业综合改革试点项目2个，省级品牌专业1个，省级重点专业（类）5个，省卓越教师培养计划项目2个，省卓越工程师教育培养计划试点专业3个，省基础课实验教学示范中心或建设点5个、省级实验教学与实践教育中心3个。
1001240003,徐州工程学院,XZIT,徐州工程学院是一所以工为主多学科协调发展的应用型本科院校，设有16个二级学院，开设56个本科专业。学校以“大应用观、大工程观、大生活观、大文化观”办学理念为引领，强化产教融合，推进学科专业一体化建设，着力提升应用型人才培养质量和服务地方经济社会能力。获批国家级特色专业、国家级工程实践教育中心、江苏品牌专业等省级以上教学项目34项，拥有江苏省工程实验室等省级以上科研平台25个，国家卓越工程师教育培养计划实施高校、国家产教融合发展工程项目试点高校。
1001243016,江苏开放大学,JSOU,江苏开放大学是由教育部批准、省人民政府主办，具有本科办学权和学士学位授予权的高等学校。学校已经建成高速便捷的远程通讯网络和覆盖全省的办学系统，拥有丰富的学习资源、完整的学习支持服务体系和素质优良的师资队伍。江苏开放大学以终身教育理念为先导，以服务全民学习、终身学习、促进人的全面发展为宗旨，以培养高素质应用型人才为任务。学校实行注册入学，坚持灵活开放的学习制度和学习成果转化与认证制度，实现了职前教育与职后教育相互衔接、学历继续教育与非学历继续教育相互沟通。
1001233002,江苏师范大学,XZNU,江苏师范大学是江苏省人民政府和教育部共建高校，学校始建于1952年，是区域引领性示范高校。学校现有4个校区，22个专业学院，63个本科招生专业，34个一级学科硕士点，13个硕士专业学位类别，一个服务于国家特殊需求博士人才培养项目，覆盖11个学科门类。学校现有全日制本科生18000余人，博士、硕士研究生3100余人。
1001237002,南京林业大学,NJFU,南京林业大学是一所中地共建的省属重点高校，前身为创建于1902年的中央大学。学校以林科为特色，以资源、生态和环境类学科为优势，九大学科门类协调发展。学校办学实力雄厚，高度重视专业和课程建设，全校现有73个本科专业，其中国家级特色专业6个、省级品牌特色专业14个、江苏高校品牌专业4个；先后获批国家级精品开放课程4门、省级精品（优秀）课程及课程群30门。十三五期间，学校实施311数字化课程建设工程，着力打造一批开放共享和本校应用相结合的优质课程，推动教学方式方法的改革创新。
1001237006,江苏理工学院,JSTU,学校座落于江苏省常州市，设有机械工程学院、电气信息工程学院、化学与环境工程学院、汽车与交通工程学院等17个二级教学单位，开设58个本科专业，全日制本科在校学生1.7万余人。目前拥有国家级特色专业建设点2个，省级品牌、重点专业16个，省卓越工程师教育培养计划试点专业群5个，省级高等教育人才培养模式创新实验基地1个，省级高校实验/实践教学示范中心13个，省级优秀教学团队2个，省级教学名师2人，省级精品（优秀）课程13门。2018年获得国家级教学成果奖3项。
1001237010,泰州学院,TZSZ,泰州学院是一所全日制公办普通本科高校，办学历史悠久。设有11个院系，本科专业分布在文学、理学、教育学、管理学、工学、法学、艺术学等学科门类。建有1个省级重点建设学科，1个省高校品牌专业建设工程项目，1 个省级基础课实验教学示范中心，2个国家教育部、财政部重点支持建设专业，3个省级特色专业；2个省“十二五”重点建设专业群。专任教师479人，高级职称214人；具有硕士及以上学位328人（博士61人）。学校坚持“文化育人”，实施“阳光教育行动”，注重国际交流与合作。
1001238002,南京信息工程大学,NUIST,南京信息工程大学享有“中国气象人才摇篮”美誉，其前身南京气象学院始建于1960年，1978年为全国重点大学，2004年更名为南京信息工程大学，是江苏省人民政府、教育部和中国气象局三方共建，具有完整的学士、硕士、博士教育培养体系，设有博士后科研流动站。大气科学学科在教育部一级学科评估中名列全国第一。校风“艰苦朴素、勤奋好学”，校训“明德格物、立己达人”，已培养包括中国科学院院士、中国工程院院士、中央部委领导及世界气象组织高级官员等在内的各类毕业生8万多人。
1001238006,江苏第二师范学院,JSIE,"江苏第二师范学院前身是创建于1952年的江苏教育学院。2013年，经教育部批准由省属成人本科学校改制为省属普通本科学校。经60余年办学实践，学院逐步形成了“教育引领科研、职前职后融通、实践取向鲜明”的办学特色。
　　学院具有长期举办本科师范教育的教学科研积累，并形成了功能完备的教师教育服务与管理体系。迄今共培养培训20多万名合格师范生和在职教师，为基础教育输送了一大批中小学教学骨干、学科带头人和教育行政干部，被社会各界誉为“江苏基础教育名师名校长的摇篮”。"
1001238010,徐州医科大学,XZMC,徐州医科大学是一所具有博士学位授权的省属普通高等医学院校。过去的五十多年，风雨与硕果同行，沧桑和凯歌同奏。一批批合格的医学人才扎根苏北、服务江苏、走向全国乃至世界，成为母校的骄傲，使徐医大宏誉远播。新时期，我们以加快发展为主题，以内涵建设为重点，以深化改革为动力，以办学特色为优势，以教育教学质量为生命，坚持规模、质量、结构、效益的协调发展，努力培养德智体全面发展的应用型现代医学人才。麻醉学教育是学校的特色和优势，学校被誉为“中国麻醉学人才培养的摇篮”。
78001,江苏科技大学,JUST,江苏科技大学是一所省部共建、以工为主、特色鲜明的普通高等学校，学校坐落在风景秀丽的中国历史文化名城——江苏省镇江市，是江苏省重点建设高校，教育部本科教学工作水平评估优秀学校，被教育部批准为卓越工程师教育培养计划高校。2012年江苏省政府与中国船舶工业集团、中国船舶重工集团公司共建江苏科技大学。
