school_id,school_name,sort_name,text
1001330001,首都经济贸易大学,CUEB,首都经济贸易大学建于1956年，是由原北京经济学院和原北京财贸学院于1995年合并、组建的北京市属重点大学。近60年来，学校已发展为拥有经济学、管理学、法学、文学、理学和工学等六大学科，以经济学、管理学为重要特色和突出优势，各学科相互支撑、协调发展的现代化、多科性财经类大学。学校劳动经济学获批国家级重点学科，并入选教育部“特色重点学科项目”。学校特大城市研究院为北京市协同创新中心，拥有北京市哲学社会科学CBD发展研究基地、北京市经济社会发展政策研究基地等市级研究机构。
1203077802,外交学院,CFAU,外交学院于1955年由周恩来总理亲自倡议、经党中央批准成立，以服务中国外交事业为宗旨，培养一流外交外事人才的小规模、高层次、特色鲜明的外交部唯一直属高校。自创建以来，外交学院为国家培养了两万余名优秀毕业生，其中有500多人担任驻外大使，被誉为“中国外交官的摇篮”。学院现拥有国际关系、外交学两个国家级重点学科，英语语言文学为国家级特色专业，国际关系、外交学和英语语言文学三个北京市重点学科。2017年9月，外交学院被教育部批准为全国95所一流学科建设高校之一。
125001,首都师范大学,CNU,首都师范大学建于1954年，办学历史可追溯至1905年成立的通州师范，是国家“双一流”建设高校、北京市与教育部“省部共建”高校。学校现有学科专业涵盖文、理、工、管、法、教育、外语、艺术等，六十多年来已培养各类高级专门人才二十余万名，是北京市人才培养的重要基地。
1001460001,首都体育学院,CUPES,首都体育学院是北京市属唯一高等体育院校。学校现有本部校区、北校区和凤凰岭校区3个校区。在校学生近5000人，其中本科生约2800人，博士、硕士研究生约800人，成人学历教育学生约700人，竞技体校学生约400人，留学生约100人。学校现有体育学和心理学两个一级学科硕士学位授权点，体育教育训练学、运动人体科学、体育人文社会学、民族传统体育学、运动康复学、运动心理学六个二级学科硕士学位授权点及体育硕士、新闻与传播硕士两个专业学位授权点。拥有北京市重点（建设）学科3个。
1001289001,北京语言大学,BLCU,北京语言大学是教育部直属高等学校，是在周恩来总理的亲自关怀下建立的，创办于1962年。北京语言大学是中国唯一一所以对来华留学生进行汉语、中华文化教育为主要任务的国际型大学，素有“小联合国”之称；学校对中国学生进行外语、中文、信息科学、金融等专业教育，同时承担着培养汉语师资、出国留学预备人员出国前的外语培训工作等任务。经过五十多年的发展，北京语言大学已经发展成为一所以语言教学与研究为特色和优势，中文、外语及相关学科协同发展的多科性大学。
1203033801,北京第二外国语学院,BISU,北京第二外国语学院是一所以外国语言文学和旅游管理为优势特色学科，文学、管理学、经济学、法学、哲学等多学科门类协调发展的著名高校，是中国外语、翻译、旅游、经贸等人才培养与研究的重要基地，是一所具有鲜明国际化特色的大学。
131003,北京物资学院,bwu,"北京物资学院是一所以物流和流通为特色，以经济学科为基础，以管理学科为主干，经、管、理、工、文、法等多学科协调发展的公办普通高等院校。1980年建校，先后隶属于国家物资总局、物资部、国内贸易部，1998年划归北京市管理。2018年，经北京市人民政府批准，北京市商务科技学校并入北京物资学院。
学校位于北京市朝阳北路东段，北京城市副中心核心区域，地处古老的京杭大运河源头，文化底蕴深厚，环境优美宜人，是北京市授予的“美丽校园”“文明校园”和“花园式单位”。校园占地670余亩，建筑面积20万余平方米，教学、科研和生活设施齐全。现有28个本科专业、5个一级学科硕士学位授权和4个专业学位硕士授权类别。现有本科生、硕士研究生、留学生等近8000人。学校面向全国30个省、自治区、直辖市招生。几十年来，学校为国家培养了大批流通领域的高级专业人才，尤其在物流、证券期货等行业中，毕业生享有较高社会声誉。"
1001222001,国际关系学院,GJGX,国际关系学院始建于1949年，在周恩来总理的亲切关怀下成立，是一所富有优良传统的高等学府。多年来党和国家领导人重视和关心学校办学工作。老一辈无产阶级周恩来、朱德、邓颖超等同志曾多次来校视察，与师生亲切交谈，给予极大关怀。陈毅副总理亲笔题写校名。邓小平、陈云、叶剑英等中央领导同志也在不同历史时期，对我校的建设与发展做出重要批示。
1001440001,中国音乐学院,CCM,中国音乐学院于1964年建立。学校坚持党的领导，坚持社会主义办学方向，以国学为根基，独具中国音乐教育和研究特色，培养中国音乐理论、中国音乐创作、中国音乐表演专门人才；以办学理念“承国学、扬国韵、育国器、强国音”为指导，倡导和建设“中国乐派”，是教育部“一流学科”建设学校、“全球音乐教育联盟”总部基地学校。素有“中国音乐家的摇篮”“中国音乐的殿堂”的美誉。
1203099801,中央美术学院,CAFA,中央美术学院是教育部直属的唯一一所高等美术学校。现设有中国画、造型、设计、建筑、人文、城市设计、实验艺术、艺术管理与教育等八个专业分院，致力于建设造型、设计、建筑、人文等学科群相互支撑、相互影响的现代形态美术教育学科结构，在构建新世纪中国特色的美术教育体系中发挥引领作用，以鲜明的中国特色、高水平的教学质量和研究成果，赢得国际美术教育界的高度赞誉，成为中国高等美术教育领域具有代表性、引领性和示范性的美术院校，并在国际一流的美术院校中享有重要地位。
1444547162,中央戏剧学院,CAD,"中央戏剧学院是新中国第一所戏剧教育高等学校，是教育部直属院校，是中国戏剧影视艺术教育的最高学府，是国家确定的世界一流学科建设高校，是中国高等戏剧教育联盟总部、亚洲戏剧教育研究中心总部和世界戏剧教育联盟秘书处所在地，是世界著名艺术院校。
中央戏剧学院设表演系、导演系、舞台美术系、戏剧文学系、音乐剧系、京剧系、歌剧系、舞剧系、偶剧系、戏剧教育系、戏剧管理系、电影电视系、戏剧学系。本科专业设置有：表演专业、戏剧影视导演专业、戏剧影视美术设计专业、戏剧影视文学专业、戏剧学专业、播音与主持艺术专业、戏剧教育专业、艺术管理专业。学院具有戏剧与影视学和艺术学理论的博士、硕士学位授权一级学科点。学院设博士后科研流动站。
在长期的办学实践中，中央戏剧学院坚持现实主义美学原则，继承中华民族美学传统，博采众长，厚基础、重实践，秉承“求真、创造、至美”的校训，致力于为国家乃至世界培养戏剧影视艺术精英人才。"
1202994801,北京服装学院,BJFZ,北京服装学院1959年2月建校，原名北京纺织工学院，1961年7月更名为北京化学纤维工学院，是由原纺织工业部建设的、以化学纤维高等教育为主的重点院校。1987年2月，改扩建为北京服装学院，为我国第一所服装高校。学校目前设有9个全日制本科教学学院（服装艺术与工程学院、服饰艺术与工程学院、材料科学与工程学院、艺术设计学院、时尚传播学院、商学院、信息工程学院、语言文化学院、美术学院），以及基础教学部、思想政治理论课教学部、研究生院、国际学院、继续教育学院。
1444154162,中国劳动关系学院,GDY142,中国劳动关系学院是中华全国总工会直属的唯一一所普通本科院校，由中华全国总工会与教育部共建。根据全国总工会和教育部的指导和要求，学校多年坚持弘扬劳动特色、工会特色、工运特色，坚定不移地走“特精尖”内涵式发展道路，已经形成了以普通本科教育为重点、工会干部培训为使命、稳步发展研究生教育、做精做强高等职业教育的办学格局，成为在工会和劳动关系领域学科门类较为齐全、完整的大学。截至2019年11月，学校共有全日制在校生6093人，其中研究生183人，本科生4785人，专科生1125人。
1001397001,天津师范大学,TJSFDX,"天津师范大学（Tianjin Normal University），简称“天师大”。坐落于中国五大国家中心城市之一——天津市。入选“卓越教师培养计划”、“特色重点学科项目”、“教育部来华留学示范基地”，“中日人文交流大学联盟”  ，是天津市属重点院校。
天津师范大学始建于1958年，原名天津师范学院，1982年更名为天津师范大学。1999年4月，原天津师范大学、天津师范高等专科学校、天津教育学院合并组建新天津师范大学。"
1001399001,天津财经大学,TJCJDX,天津财经大学是新中国最早建立的财经大学之一，是一所以经济学和管理学为主干，兼有法学、文学、理学、工学、教育学、艺术学等学科门类交叉渗透、协调发展的多科性大学。学校现拥有应用经济学、工商管理、管理科学与工程等3个一级学科博士学位授权点和博士后科研流动站，应用经济学等9个一级学科硕士学位授权点，工商管理硕士等13个专业硕士学位授权点。现开设49个本科专业，在校生15000余人，其中本科生12000余人、研究生近3000人。
1001309001,河北科技大学,HEBUST,河北科技大学是河北省重点建设的多科性骨干大学， 学校设有75个本科专业，涉及工、理、文、经、管、法、医、教育、艺术等九大门类。理工、文史类专业在河北省内全部本科一批招生。具有16个硕士学位授权一级学科，涵盖92个硕士学位授权二级学科。学校大力弘扬“进取、协作、奉献”的科大精神，形成了和而不同的文化理念、营造了内和外顺的发展环境。学校正围绕建设特色鲜明的全国知名大学的目标，抢抓机遇、创新发展，努力为国家和区域经济社会发展做出更大的贡献！
52001,河北师范大学,HEBTU,河北师范大学（Hebei Normal University）位于河北省省会石家庄市，是一所具有百年历史和光荣传统的省属重点大学。学校起源于1902年创建于北京的顺天府学堂和1906年创建于天津的北洋女师范学堂。1996年6月，原河北师范大学、河北师范学院、创建于1952年的河北教育学院以及创建于1984年的河北职业技术师范学院合并，组建成新的河北师范大学，是中国较早成立、规模较大的高等师范院校之一。
1001196001,保定学院,BDU,保定学院坐落于历史文化名城保定市，创建于1904年，始称“保定初级师范学堂”。学院占地近千亩，现有33个本科专业，全日制在校生14500余人。“德业兼修，知行并重”的教育理念和百年的历史积淀孕育了保定学院独有的校本传统和深厚的文化底蕴，培育出了以“西部支教毕业生群体”为代表的大批优秀人才，为地方教育和社会经济发展做出了重要贡献。2015年，被中央文明委授予“全国文明单位”荣誉称号。
1202954801,邢台学院,XTTC,邢台学院是一所省市共建、以市为主的全日制普通本科院校。学校前身直隶第四初级师范学堂，始建于1910年（清宣统二年），至今已有109年历史，是河北省最早成立的四所师范之一。成立初期的旧址部分仍保留在校园内，该旧址见证了中国师范教育百年发展历程。1996年3月，邢台师范专科学校、邢台教育学院、邢台经济管理干部学校三校合并，成立邢台师范高等专科学校。2002年3月，经教育部批准升格为邢台学院。
1001495003,山西大学,SXU,"山西大学前身为创建于1902年的山西大学堂，是中国最早的三所国立大学之一。改革开放后，山西大学伴随着我国科教兴国和高等教育崛起的良好机遇，成为一所文理相互渗透的综合性大学。1998年成为山西省重点建设大学。2005年，成为省部共建大学。2012年，山西大学成为“中西部高校提升综合实力”入选高校,迈上国家建设“有特色、高水平”大学的新平台。 2018年，成为部省合建高校。在新的历史起点上，学校将以提升质量为核心，走内涵式发展道路，加快建设区域特色鲜明的高水平研究型大学。"
1202998802,山西医科大学,SXMU,山西医科大学占地1422亩，现有29个本科专业、31个教学机构，12所直属附属医院，教师1900余人，研究生导师1600余人。学校为全国首批硕士学位授权单位、全国首批学士学位授权单位、全国第三批和山西省首批博士学位授权单位、全国首批护理学博士学位授权单位、全国开办七年制临床医学专业的25所医学院校之一、教育部首批“卓越医生教育培养计划”试点单位。有3个一级学科设有博士后科研流动站，6个一级学科博士学位授权点，9个一级学科硕士学位授权点。2018年已接受教育部本科教学工作审核评估。
1203127801,中国刑事警察学院,XSJC,中国刑事警察学院是我国最早建立的公安教育机构，创建于1948年5月，前身是东北公安干部学校，先后改为中央人民警察干部学校、公安部第一人民警察干部学校、公安部人民警察干部学校，1981年11月扩建为中国刑事警察学院，是最早开展公安专业本科学历教育的公安高等院校。建校以来，学校始终秉承“忠诚、求是、团结、奋进”的校训，始终以服务公安工作和公安队伍建设为宗旨，为公安事业发展和法治社会建设做出了积极贡献，被誉为“东方福尔摩斯的摇篮”和“中国刑警的最高学府”。
1001609001,内蒙古民族大学,IMUN,内蒙古民族大学（Inner Mongolia University For The Nationlities）位于内蒙古东部通辽市，是一所综合型民族大学，为内蒙古自治区重点建设高校、内蒙古自治区人民政府和国家民族事务委员会共建高校、中西部高校基础能力建设工程（二期）支持高校，系欧亚-太平洋大学联盟成员。 [1]
1001502001,沈阳工业大学,SUT,沈阳工业大学是以工为主的多学科性研究应用型大学，始建于1949年，具有学士、硕士、博士三级学位授予权。学校现有一级学科博士点5个，一级学科硕士点20个，本科专业53个。其中，电机与电器是国家重点二级学科，4个省级重点建设学科。学校牢固树立教学中心地位，坚持立德树人、内涵发展，以人才培养供给侧改革为抓手，着力创建一流本科教育，打造一流专业与课程，学生的社会责任感、创新精神和实践能力不断提升，荣获全国创新创业教育改革示范校，列为辽宁省“双一流”重点建设高校。
1001518001,大连工业大学,DLPU,大连工业大学是东北地区唯一一所以轻纺为特色的高等学校，总占地面积1064亩，总建筑面积48万平方米。以工为主，工、理、艺、文、管、经六大学科协调发展，以培养轻工、纺织、食品、艺术等专业人才为办学特色的高等学府。学校伴随着祖国前进的脚步和现代化建设的进程而不断发展，形成了“博学精思，笃行致新”的校训，遵循新时期以人为本、强化内涵、彰显特色、开拓致新的办学理念，在人才培养、科学研究、传承文明、服务社会等方面为国家做出了积极贡献。
1202984801,大连海洋大学,DLOU,大连海洋大学是我国北方地区唯一的一所以海洋和水产学科为特色，农、工、理、管、文、法、经、艺等学科协调发展的多科性高等院校。学校学科体系完善，优势特色学科明显，注重教育教学改革，教学成果丰硕。拥有一支结构相对合理，学科领域覆盖较全的师资队伍，较为完备的教学科研平台，科技创新能力不断增强。学校以建设“蓝色大学”为发展理念，朝着“特色鲜明、国家一流研究应用型海洋大学”的奋斗目标加速迈进！
1001319001,中国医科大学,CMU,"中国医科大学位于辽宁省沈阳市，是中国共产党最早创建的院校，是我国最早进行西医学学院式教育的院校之一。
建校至今，共培养了9万多名高级医学专门人才。造就了一大批国家卫生管理的高级领导干部和著名医学专家。目前学校在基础医学、临床医学、生物学、口腔医学、公共卫生与预防医学、护理学等6个学科具有一级学科博士学位授予权，有5个国家重点学科和1个国家重点（培育）学科、40个国家卫生计生委国家临床重点专科建设项目、6个辽宁省高等学校一流特色学科、7个博士后流动站和21个本科专业。"
1203098801,辽宁中医药大学,LNUTCM,辽宁中医药大学（原辽宁中医学院）创建于1958年，是辽宁省委批准，由辽宁省中医进修学校（1955年）、辽宁省中医医院（1956年）合并组建的中医药本科院校。2000年，辽宁卫生职工医学院并入我校。2006年经教育部批准，学校更名为“辽宁中医药大学”。2013年经辽宁省批准，学校增具“辽宁省中医药科学院”名称。
1001224001,渤海大学,BHU,渤海大学（BOHAI University）简称渤大，位于渤海之滨的历史文化名城辽宁省锦州市。是辽宁省政府举办的综合性大学，由锦州师范学院与辽宁商业高等专科学校于2000年4月5日合并组建而成，时学校暂定名为锦州师范学院。2003年4月，更名为渤海大学。
1001426001,沈阳师范大学,SYNU,沈阳师范大学隶属于辽宁省人民政府，是一所涵盖哲学、经济学、法学、教育学、文学、理学、工学、管理学、艺术学等九大门类的多科性大学。学校始建于1951年，其前身为东北教育学院。1953年，更名为沈阳师范学院，是当时东北地区创办最早的两所本科师范院校之一。1965年更名为辽宁第一师范学院。1978年恢复沈阳师范学院校名。2002年省政府决定并经教育部批准，沈阳师范学院与辽宁教育学院合并组建沈阳师范大学。
108001,东北财经大学,DUFE,"东北财经大学（Dongbei University of Finance and Economics）简称“东财”，坐落于辽宁省大连市。是财政部、教育部和辽宁省人民政府共同重点建设的高校。
东财前身是1952年10月开始组建的东北财经学院；1985年更名为东北财经大学；2010年东北财经大学入选国家特色重点学科项目；2012年4月，中华人民共和国财政部、中华人民共和国教育部和辽宁省人民政府签署协议成为省部共建大学；2012年8月，东北财经大学成为“高等学校创新能力提升计划”主要参与高校。"
1001501001,通化师范学院,THNU,通化师范学院是吉林省东南部唯一一所省属本科院校，坐落于长白山脚下、鸭绿江畔、中朝边境的通化市。学校始终秉承“崇德广业、与时偕行”的校训，坚守“质朴的教育”理念，传承“靖宇精神建校育人、服务长白山区”的办学特色，坚持“质量立校、人才强校、科研兴校、特色活校”的办学方略，凸显“一师一山一城一族一史”的办学优势，为地方经济建设与社会发展作出了重要贡献。2007年，学校顺利通过教育部本科教学水平评估。2016年，学校顺利通过教育部本科教学工作审核评估。
1001591003,长春师范大学,CCSFDX,长春师范大学（Changchun Normal University）坐落在美丽的北国春城——长春，是吉林省重要的基础教育、学前教育师资及应用型高级专门人才培养基地，是具有博士学位授予权的省属师范大学。
1203207801,长春中医药大学,CCUCM,长春中医药大学前身为1958年成立的长春中医学院，2006年更名大学，是吉林省重点高校、中西部高校基础能力建设工程重点建设大学，是第一届全国文明校园、教育部第一批全国中小学生研学实践教育基地、国家大学生文化素质教育基地。
1001200001,黑龙江大学,HLJU,黑龙江大学是教育部与黑龙江省人民政府共建的有特色、高水平、现代化地方综合性大学，坐落于北国冰城哈尔滨，其前身是1941年成立的中国人民抗日军政大学第三分校俄文队。办学70多年以来，黑龙江大学在国家全球战略构架中，推进与服务中俄战略协作伙伴关系提升，强化俄语学科专业的优势地位和引领作用，实现人才培养方向、科学研究领域、对外交流合作和社会服务等多方位与俄罗斯对接，形成全国高校独树一帜的对俄办学特色。
1202976801,哈尔滨医科大学,HEBYKDX,哈尔滨医科大学由我国医学先驱伍连德博士于1926年创建的哈尔滨医学专门学校和兴山中国医科大学第一、二分校组建而成，是部委省共建大学、黑龙江省高水平大学和优势特色学科建设高校、中俄医科大学联盟中方牵头单位、国家理科基础科学研究与教学人才培养基地、教育部首批试办七年制高等医学教育院校。
50001,哈尔滨师范大学,HRBNU,哈尔滨师范大学是一所具有悠久办学历史的省属重点大学，是黑龙江省教育、艺术、人文社会科学和自然科学的重要人才培养基地和科学研究基地，是黑龙江省重点建设的省属高水平大学。建校67年来，学校秉承“敦品励学，弘毅致远”的校训精神，努力践行“学高为师，身正为范”的从师准则，发扬“敢为人先、争创一流、艰苦奋斗、求真务实、与时俱进、开拓创新”的优良传统，培养和输送了34万余名各级各类优秀人才，为国家和地方经济社会科学文化发展做出了重要贡献。
54001,上海海事大学,SHMUT,"中国高等航海教育发轫于上海，1909年晚清邮传部上海高等实业学堂（南洋公学）船政科开创了我国高等航海教育的先河。1912年成立吴淞商船学校，1933年更名为吴淞商船专科学校。1959年交通部在沪组建上海海运学院。2004年经教育部批准更名为上海海事大学。2008年上海海事大学主体搬迁临港新城(现上海自贸区临港新片区)。
上海海事大学是一所以航运、物流、海洋为特色，具有工学、管理学、经济学、法学、文学、理学和艺术学等学科门类的多科性大学。有各类学生24000余名。"
1001577001,上海对外经贸大学,SUIBE,"上海对外经贸大学是全国最早开展国际经贸专门人才培养的财经类高校之一。学校构筑以应用经济学为核心，经管文法理交叉协调发展的学科体系。本科专业30个，学科门类5个，一级学科硕士点4个、二级学科硕士点33个和专业学位硕士点8个。
        学校践行“以学生为本、以学术为魂”的办学理念，人才培养质量不断提升。2006年教育部本科教学评估获“优秀”；2016年教育部第四轮学科评估被评为B。2017年中国最好大学排名（生源质量）位列第85名；2016年中国大学毕业生薪酬排行榜高居第11位。"
1203051801,上海应用技术大学,SIT,学校肇始于1954年，是由全国示范性高工专——上海轻工业高等专科学校、上海冶金高等专科学校、上海化工高等专科学校以及原国家轻工业部所属上海香料研究所合并组建而成。2016年经由教育部批准，更名为“上海应用技术大学”。学校入选“教育部卓越工程师教育培养计划”、全国100所应用型示范本科高校建设单位、上海市首批深化创新创业教育改革示范高校，是应用技术大学（学院）联盟成员，是一所以应用型、技术型科学研究为导向，以工科为主、经管文理多学科协调发展，特色鲜明的应用技术大学。
1202995801,上海中医药大学,SHUTCM,上海中医药大学创办于1956年，是新中国诞生后国家首批建立的中医药高等院校之一，是教育部与上海市人民政府共建高校，也是上海市重点建设的高水平大学，国家“双一流”世界一流学科建设高校，世界一流中医药大学建设联盟创始成员，上海市高水平地方高校建设试点单位。
